company_name,role,country,date,hr_name
Vector Informatik GmbH az,Backend Engineer,Germany,08-04-2026,Hiring Manager
Vector Informatik GmbH ba,Software Engineer Java,Germany,08-04-2026,Hiring Manager
Vector Informatik GmbH bb,Microservices Developer,Germany,08-04-2026,Hiring Manager
Vector Informatik GmbH bc,Spring Boot Developer,Germany,08-04-2026,Hiring Manager
DSC Software AG a,API Developer,Germany,08-04-2026,Hiring Manager
emmtrix Technologies GmbH a,Software Engineer Backend,Germany,08-04-2026,Hiring Manager
