company_name,role,country,date,hr_name
Creditplus Bank AG - Filiale Hannover a,Accounts Receivable Specialist,Germany,01-05-2026,Hiring Manager
BNP Paribas House Hannover a,AR Analyst,Germany,01-05-2026,Hiring Manager
Lange Corporate Finance GmbH a,Order to Cash Specialist,Germany,01-05-2026,Hiring Manager
Corporate Finance Hannover GmbH a,Collections Specialist,Germany,01-05-2026,Hiring Manager
HANNOVER Finanz GmbH a,Billing Analyst,Germany,01-05-2026,Hiring Manager
HANNOVER Finanz GmbH b,Credit Control Analyst,Germany,01-05-2026,Hiring Manager
HANNOVER Finanz GmbH c,OTC Analyst,Germany,01-05-2026,Hiring Manager
