company_name,role,country,date,hr_name
Polygran GmbH a,CXM Transformation Lead,Germany,09-04-2026,Hiring Manager
GSMB Agency GmbH a,Customer Experience Manager,Germany,09-04-2026,Hiring Manager
IT Consulting Kühnl a,CRM Program Manager,Germany,09-04-2026,Hiring Manager
Inway Systems GmbH a,CX Strategy Lead,Germany,09-04-2026,Hiring Manager
Inway Systems GmbH b,Contact Center Transformation Lead,Germany,09-04-2026,Hiring Manager
WP Nova GmbH a,CX Consultant,Germany,09-04-2026,Hiring Manager
AIS alfaplan GmbH a,Digital Transformation Manager (CXM),Germany,09-04-2026,Hiring Manager
