company_name,role,country,date,hr_name
nimbus health GmbH d,Hospital Pharmacist,Germany,28-04-2026,Hiring Manager
Amcapharm Pharmaceutical GmbH a,Clinical Pharmacist,Germany,28-04-2026,Hiring Manager
HWI pharma services GmbH a,Inpatient Pharmacist,Germany,28-04-2026,Hiring Manager
HWI pharma services GmbH b,Outpatient Pharmacist,Germany,28-04-2026,Hiring Manager
Bundesverband der Arzneimittel-Hersteller e.V. a,Pharmacy Officer,Germany,28-04-2026,Hiring Manager
MEDI-CENTER Mittelrhein GmbH a,Medication Safety Pharmacist,Germany,28-04-2026,Hiring Manager
enua Pharma GmbH a,Drug Safety Associate,Germany,28-04-2026,Hiring Manager
