company_name,role,country,date,hr_name
Quirin Privatbank AG Wiesbaden a,Account Manager,Germany,10-04-2026,Hiring Manager
Wiesbadener Volksbank - Private Banking Vermögensverwaltung & a,Senior Account Manager,Germany,10-04-2026,Hiring Manager
Economic and infrastructure Hessen (WIBank) a,Key Account Manager,Germany,10-04-2026,Hiring Manager
Economic and infrastructure Hessen (WIBank) b,Business Development Manager,Germany,10-04-2026,Hiring Manager
TARGOBANK b,Sales Manager Life Sciences,Germany,10-04-2026,Hiring Manager
Santander a,Product Manager Life Sciences,Germany,10-04-2026,Hiring Manager
Deutsche Bank Filiale c,Territory Manager,Germany,10-04-2026,Hiring Manager
