company_name,role,country,date,hr_name
Next Iteration Gesellschaft für Software Engineering mbH a,Full Stack Developer,Germany,14-04-2026,Hiring Manager
Next Iteration Gesellschaft für Software Engineering mbH b,Software Engineer,Germany,14-04-2026,Hiring Manager
ITstrategen GmbH a,Web Developer,Germany,14-04-2026,Hiring Manager
ITstrategen GmbH b,Java Full Stack Developer,Germany,14-04-2026,Hiring Manager
PLANTA Projektmanagement-Systeme GmbH a,MERN Stack Developer,Germany,14-04-2026,Hiring Manager
PLANTA Projektmanagement-Systeme GmbH b,Backend Developer,Germany,14-04-2026,Hiring Manager
BTS Technische Software GmbH a,Frontend Developer,Germany,14-04-2026,Hiring Manager
