company_name,role,country,date,hr_name
"DIB | Sheikh Zayed Road Branch, Dubai",Banking Operations Executive,UAE,07-04-2026,Hiring Manager
IndusInd Bank,Loan Operations Specialist,UAE,07-04-2026,Hiring Manager
Federal Bank ATM,Credit Analyst,UAE,07-04-2026,Hiring Manager
Jana Small Finance Bank ATM,Branch Operations Manager,UAE,07-04-2026,Hiring Manager
"Bank of America N.A., India",Retail Banking Executive,UAE,07-04-2026,Hiring Manager
DCB Bank ATM - Jakkasandra,Relationship Manager,UAE,07-04-2026,Hiring Manager
Al Maryah Community Bank - Mall Of The Emirates - a,Loan Processing Officer,UAE,07-04-2026,Hiring Manager
Accurate Vision Accounting & Bookkeeping,Credit Operations Analyst,UAE,07-04-2026,Hiring Manager
SL Professionals,Banking Customer Service Executive,UAE,07-04-2026,Hiring Manager
Seedmap Group,Banking Officer,UAE,07-04-2026,Hiring Manager
Select Group,Loan Servicing Specialist,UAE,07-04-2026,Hiring Manager
Бизнес Бутик | Business Boutique DMCC | UAE Consultants,Credit Processing Executive,UAE,07-04-2026,Hiring Manager
Aviaan Accounting LLC,Retail Banking Associate,UAE,07-04-2026,Hiring Manager
Aviaan Accounting LLC - a,Banking Operations Analyst,UAE,07-04-2026,Hiring Manager
Business Setup In Dubai — Relocate UAE,Banking Operations Executive,UAE,07-04-2026,Hiring Manager
Petra Insurance Broker L.L.C.,Loan Operations Specialist,UAE,07-04-2026,Hiring Manager
"UAE Cash Loans - Compare and get the best Personal Loan offers from trusted Banks in Dubai, UAE",Credit Analyst,UAE,07-04-2026,Hiring Manager
Pearl Insurance Brokers Co LLC - c,Branch Operations Manager,UAE,07-04-2026,Hiring Manager
Adamjee Insurance Company Ltd,Retail Banking Executive,UAE,07-04-2026,Hiring Manager
Insurance Pro.ae,Relationship Manager,UAE,07-04-2026,Hiring Manager
Interactive Insurance Brokers Co LLC,Loan Processing Officer,UAE,07-04-2026,Hiring Manager
Future Insurance Broker Services LLC,Credit Operations Analyst,UAE,07-04-2026,Hiring Manager
Fidelity Insurance Services L.L.C,Banking Customer Service Executive,UAE,07-04-2026,Hiring Manager
Iran Insurance,Financial Services Associate,UAE,07-04-2026,Hiring Manager
Alia Insurance Broker,Banking Officer,UAE,07-04-2026,Hiring Manager
Insurer.ae,Loan Servicing Specialist,UAE,07-04-2026,Hiring Manager
Adamjee insurance Company Ltd. Sharjah Branch تأمين آدمجي,Credit Processing Executive,UAE,07-04-2026,Hiring Manager
Tajdeed RTA Vehicle Testing Center,Retail Banking Associate,UAE,07-04-2026,Hiring Manager
Tajdeed RTA Vehicle Testing Center - a,Banking Operations Analyst,UAE,07-04-2026,Hiring Manager
AX CAPITAL Dubai,Banking Operations Executive,UAE,07-04-2026,Hiring Manager
Falak Tayyeb Platinum Government Services L.L.C | فالك طيب بلاتينيوم للخدمات الحكومية ذ.م.م,Loan Operations Specialist,UAE,07-04-2026,Hiring Manager
𝐎𝐦𝐞𝐠𝐚 𝐈𝐧𝐬𝐮𝐫𝐚𝐧𝐜𝐞 𝐁𝐫𝐨𝐤𝐞𝐫𝐬 𝐋𝐋𝐂✅ | Best Insurance Broker in Dubai & Abu Dhabi | UAE | Since 2003 | 20+ Years of Excellence - a,Branch Operations Manager,UAE,07-04-2026,Hiring Manager
Al Sayegh Insurance Brokers LLC,Retail Banking Executive,UAE,07-04-2026,Hiring Manager
"Federal Insurance Brokers LLC (FISCO) | Corporate & Personal Insurance Brokers Dubai, UAE",Relationship Manager,UAE,07-04-2026,Hiring Manager
Dubai Online Insurance,Loan Processing Officer,UAE,07-04-2026,Hiring Manager
Shory,Credit Operations Analyst,UAE,07-04-2026,Hiring Manager
TheInsuranceOffers.com,Banking Customer Service Executive,UAE,07-04-2026,Hiring Manager
Abu Dhabi Insurance Brokers L.L.C,Financial Services Associate,UAE,07-04-2026,Hiring Manager
Axis Insurance Brokers LLC,Banking Officer,UAE,07-04-2026,Hiring Manager
Axis Insurance Brokers LLC - a,Loan Servicing Specialist,UAE,07-04-2026,Hiring Manager
Abu Dhabi National Insurance Co. (ADNIC),Retail Banking Associate,UAE,07-04-2026,Hiring Manager
Abu Dhabi National Insurance Co. (ADNIC) - a,Banking Operations Analyst,UAE,07-04-2026,Hiring Manager
Liberty Insurance Brokers LLC.,Banking Operations Executive,UAE,07-04-2026,Hiring Manager
Al Khazna Insurance Company P. S. C. - Head Office,Loan Operations Specialist,UAE,07-04-2026,Hiring Manager
Al Nahda National Insurance Brokers Company,Credit Analyst,UAE,07-04-2026,Hiring Manager
Al Berwaz Insurance Brokers LLC,Branch Operations Manager,UAE,07-04-2026,Hiring Manager
Prime Insurance Brokers,Retail Banking Executive,UAE,07-04-2026,Hiring Manager
Gras Savoye Gulf Insurance Broker LLC,Relationship Manager,UAE,07-04-2026,Hiring Manager
Star Insurance Services Co. LLC,Loan Processing Officer,UAE,07-04-2026,Hiring Manager
"Sharjah Insurance Company Head Office , Al Raha Tower",Credit Operations Analyst,UAE,07-04-2026,Hiring Manager
Delta Insurance Services LLC,Banking Customer Service Executive,UAE,07-04-2026,Hiring Manager
Hosn Al Sharjah Insurance Services LLC,Financial Services Associate,UAE,07-04-2026,Hiring Manager
Al Ain Ahlia Insurance Company - Sharjah Branch,Banking Officer,UAE,07-04-2026,Hiring Manager
Watania Takaful – Abu Dhabi,Loan Servicing Specialist,UAE,07-04-2026,Hiring Manager
Abu Dhabi National Takaful Co. PSC,Banking Operations Analyst,UAE,07-04-2026,Hiring Manager
Tawasul Insurance Services LLC,Banking Operations Executive,UAE,07-04-2026,Hiring Manager
Leaders Insurance Brokers LLC,Loan Operations Specialist,UAE,07-04-2026,Hiring Manager
Egyptian Insurance Brokers Co. LLC,Credit Analyst,UAE,07-04-2026,Hiring Manager
AL ITTIHAD AL WATANI,Branch Operations Manager,UAE,07-04-2026,Hiring Manager
Insurance Wings,Retail Banking Executive,UAE,07-04-2026,Hiring Manager
Nasco Emirates,Relationship Manager,UAE,07-04-2026,Hiring Manager
TECHNICAL INSURANCE SERVICES,Loan Processing Officer,UAE,07-04-2026,Hiring Manager
Marina Insurance Brokers,Credit Operations Analyst,UAE,07-04-2026,Hiring Manager
MEDGULF ABU DHABI,Banking Customer Service Executive,UAE,07-04-2026,Hiring Manager
Mazaya Insurance Brokerage,Financial Services Associate,UAE,07-04-2026,Hiring Manager
Promise Insurance Services L.L.C,Banking Officer,UAE,07-04-2026,Hiring Manager
RIZMAK Consultancy,Loan Servicing Specialist,UAE,07-04-2026,Hiring Manager
Custodians Insurance Consultancy,Credit Processing Executive,UAE,07-04-2026,Hiring Manager
Joie de Vivre International Insurance Brokerage LLC,Retail Banking Associate,UAE,07-04-2026,Hiring Manager
Joie de Vivre International Insurance Brokerage LLC - a,Banking Operations Analyst,UAE,07-04-2026,Hiring Manager
Insuresouq,Banking Operations Executive,UAE,07-04-2026,Hiring Manager
Gulf Oasis Insurance Brokers LLC,Loan Operations Specialist,UAE,07-04-2026,Hiring Manager
Oriental Insurance Company Limited,Credit Analyst,UAE,07-04-2026,Hiring Manager
Al Redha Insurance Brokers LLC,Branch Operations Manager,UAE,07-04-2026,Hiring Manager
Honor Insurance Brokers LLC,Retail Banking Executive,UAE,07-04-2026,Hiring Manager
Gulf Ocean International Insurance Brokers LLC,Relationship Manager,UAE,07-04-2026,Hiring Manager
DoozyOnline Car Insurance UAE,Loan Processing Officer,UAE,07-04-2026,Hiring Manager
KK Bridge Solutions FZ LLC,Credit Operations Analyst,UAE,07-04-2026,Hiring Manager
KK Bridge Solutions FZ LLC - a,Banking Customer Service Executive,UAE,07-04-2026,Hiring Manager
UIB (United Insurance Brokers LLC),Financial Services Associate,UAE,07-04-2026,Hiring Manager
Beneple,Banking Officer,UAE,07-04-2026,Hiring Manager
"BMS Masaood, Dubai",Loan Servicing Specialist,UAE,07-04-2026,Hiring Manager
Easy Loan Financing Broker Dubai UAE,Credit Processing Executive,UAE,07-04-2026,Hiring Manager
Quick Finserv Loans and Overdues Resheduling Services LLC,Retail Banking Associate,UAE,07-04-2026,Hiring Manager
Bronze Wing Trading L.L.C.,Banking Operations Executive,UAE,07-04-2026,Hiring Manager
RSN Finance Consultancy | Accounting firms in Dubai UAE | Audit firms in Dubai UAE | Business setup firms in Dubai UAE,Loan Operations Specialist,UAE,07-04-2026,Hiring Manager
Finovative Gulf,Credit Analyst,UAE,07-04-2026,Hiring Manager
Taskmaster Commercial Broker llc,Branch Operations Manager,UAE,07-04-2026,Hiring Manager
Taskmaster Commercial Broker llc - a,Retail Banking Executive,UAE,07-04-2026,Hiring Manager
BHM Capital Financial Services PSC,Relationship Manager,UAE,07-04-2026,Hiring Manager
Xperts Solutions,Loan Processing Officer,UAE,07-04-2026,Hiring Manager
FINPRO BANKING CONSULTANT LLC Dubai United Arab Emirates,Credit Operations Analyst,UAE,07-04-2026,Hiring Manager
Capital Zone Mortgage Broker - Best Mortgage Broker,Banking Customer Service Executive,UAE,07-04-2026,Hiring Manager
Ascentia UAE - Accounting- Auditing- Corporate Services-Tax Advisory,Financial Services Associate,UAE,07-04-2026,Hiring Manager
