company_name,role,country,date,hr_name
Vector Informatik GmbH ai,Power Automate Developer,Germany,06-04-2026,Hiring Manager
Vector Informatik GmbH aj,RPA Solution Architect,Germany,06-04-2026,Hiring Manager
Vector Informatik GmbH ak,Automation Consultant,Germany,06-04-2026,Hiring Manager
Vector Informatik GmbH al,Robotics Process Automation Engineer,Germany,06-04-2026,Hiring Manager
Vector Informatik GmbH an,Process Automation Engineer,Germany,06-04-2026,Hiring Manager
Vector Informatik GmbH ao,AI Automation Engineer,Germany,06-04-2026,Hiring Manager
Vector Informatik GmbH ap,Automation Lead,Germany,06-04-2026,Hiring Manager
