company_name,role,country,date,hr_name
Berliner Bau Strateg GmbH a,Project Manager Construction,Germany,07-04-2026,Hiring Manager
Silver construction engineering GmbH a,Senior Project Manager,Germany,07-04-2026,Hiring Manager
Green Workers | Innovative nachhaltige Baudienstleistungen a,Construction Manager,Germany,07-04-2026,Hiring Manager
IngenieurGruppe Bauen Berlin a,Fit-out Project Manager,Germany,07-04-2026,Hiring Manager
Amba Fassadenbau GmbH a,Civil Project Manager,Germany,07-04-2026,Hiring Manager
