company_name,role,country,date,hr_name
SMART DATA Deutschland GmbH a,DB2 System Engineer,Germany,17-04-2026,Hiring Manager
SMART DATA Deutschland GmbH b,Mainframe Engineer,Germany,17-04-2026,Hiring Manager
Bolinda Labs GmbH a,z/OS Engineer,Germany,17-04-2026,Hiring Manager
codecare software GmbH a,DB2 Database Administrator,Germany,17-04-2026,Hiring Manager
NSK GmbH & Co. KG a,Systems Programmer (Mainframe),Germany,17-04-2026,Hiring Manager
SOFTTAILOR GmbH a,Infrastructure Engineer (Mainframe),Germany,17-04-2026,Hiring Manager
blink.it a,Production Support Engineer (L3),Germany,17-04-2026,Hiring Manager
