company_name,role,country,date,hr_name
Next Iteration Gesellschaft für Software Engineering mbH a,Senior RPA Developer,Germany,28-04-2026,Hiring Manager
Next Iteration Gesellschaft für Software Engineering mbH b,RPA Developer,Germany,28-04-2026,Hiring Manager
ITstrategen GmbH a,RPA Consultant,Germany,28-04-2026,Hiring Manager
ITstrategen GmbH b,Automation Engineer,Germany,28-04-2026,Hiring Manager
PLANTA Projektmanagement-Systeme GmbH a,Intelligent Automation Engineer,Germany,28-04-2026,Hiring Manager
PLANTA Projektmanagement-Systeme GmbH b,UiPath Developer,Germany,28-04-2026,Hiring Manager
BTS Technische Software GmbH a,Process Automation Specialist,Germany,28-04-2026,Hiring Manager
