company_name,role,country,date,hr_name
Vector Informatik GmbH r,IT Service Delivery Manager,Germany,10-04-2026,Hiring Manager
Vector Informatik GmbH s,ITSM Manager,Germany,10-04-2026,Hiring Manager
Vector Informatik GmbH t,Service Operations Manager,Germany,10-04-2026,Hiring Manager
Vector Informatik GmbH u,IT Operations Manager,Germany,10-04-2026,Hiring Manager
Vector Informatik GmbH v,Incident Manager,Germany,10-04-2026,Hiring Manager
Vector Informatik GmbH w,Problem Manager,Germany,10-04-2026,Hiring Manager
Vector Informatik GmbH x,Change Manager,Germany,10-04-2026,Hiring Manager
