company_name,role,country,date,hr_name
ARCHIBUS Solution Centers Germany-Saarbrücken GmbH a,Knowledge Management Analyst,Germany,06-05-2026,Hiring Manager
Max Planck Institute for Software Systems a,Content Quality Analyst,Germany,06-05-2026,Hiring Manager
BSNSoft Solutions GmbH a,Content Analyst,Germany,06-05-2026,Hiring Manager
IT Netzwerke Kreutzer & Tries GmbH a,Documentation Specialist,Germany,06-05-2026,Hiring Manager
Facility Management Software GIS PROJECT a,Technical Writer,Germany,06-05-2026,Hiring Manager
MBSol Internet Solutions a,Knowledge Base Specialist,Germany,06-05-2026,Hiring Manager
