company_name,role,country,date,hr_name
LBS Köln Neumarkt h,Payments Analyst,Germany,06-05-2026,Hiring Manager
LBS Köln Neumarkt i,Payments Operations Analyst,Germany,06-05-2026,Hiring Manager
LBS Köln Neumarkt j,Banking Operations Executive,Germany,06-05-2026,Hiring Manager
antaga GmbH Wirtschaftsprüfungsgesellschaft a,Transaction Processing Analyst,Germany,06-05-2026,Hiring Manager
Degussa Goldhandel GmbH a,Reconciliation Analyst,Germany,06-05-2026,Hiring Manager
SIGNAL IDUNA Köln Versicherungsstrategen GmbH a,SWIFT Operations Analyst,Germany,06-05-2026,Hiring Manager
SIGNAL IDUNA Köln Versicherungsstrategen GmbH b,Fintech Operations Executive,Germany,06-05-2026,Hiring Manager
