company_name,role,country,date,hr_name
Vector Informatik GmbH y,Embedded Software Engineer,Germany,15-04-2026,Hiring Manager
Vector Informatik GmbH z,Test Automation Engineer,Germany,15-04-2026,Hiring Manager
Vector Informatik GmbH aa,Embedded Linux Engineer,Germany,15-04-2026,Hiring Manager
Vector Informatik GmbH ab,BSP Engineer,Germany,15-04-2026,Hiring Manager
Vector Informatik GmbH ac,Systems Validation Engineer,Germany,15-04-2026,Hiring Manager
Vector Informatik GmbH ad,QA Automation Engineer Embedded,Germany,15-04-2026,Hiring Manager
Vector Informatik GmbH ae,Linux Systems Engineer,Germany,15-04-2026,Hiring Manager
