company_name,role,country,date,hr_name
Vector Informatik GmbH ai,Full Stack Developer,Germany,09-04-2026,Hiring Manager
Vector Informatik GmbH aj,Software Engineer,Germany,09-04-2026,Hiring Manager
Vector Informatik GmbH ak,Web Developer,Germany,09-04-2026,Hiring Manager
Vector Informatik GmbH al,Java Full Stack Developer,Germany,09-04-2026,Hiring Manager
Vector Informatik GmbH am,MERN Stack Developer,Germany,09-04-2026,Hiring Manager
Vector Informatik GmbH an,Backend Developer,Germany,09-04-2026,Hiring Manager
Vector Informatik GmbH ao,Frontend Developer,Germany,09-04-2026,Hiring Manager
