company_name,role,country,date,hr_name
"Evangelische Bank eG, Hamburg a",Branch Operations Manager,Germany,06-05-2026,Hiring Manager
"Evangelische Bank eG, Hamburg b",Banking Operations Manager,Germany,06-05-2026,Hiring Manager
"Evangelische Bank eG, Hamburg d",Customer Service Manager Banking,Germany,06-05-2026,Hiring Manager
Quirin Privatbank AG Düsseldorf a,Branch Manager,Germany,06-05-2026,Hiring Manager
HSBC Germany Holdings GmbH a,Assistant Branch Manager,Germany,06-05-2026,Hiring Manager
"KBC Bank NV, Niederlassung Deutschland a",Operations Manager Banking,Germany,06-05-2026,Hiring Manager
