company_name,role,country,date,hr_name
Leipziger Volksbank eG c,Accounts Receivable Specialist,Germany,15-04-2026,Hiring Manager
Leipziger Volksbank eG d,AR Analyst,Germany,15-04-2026,Hiring Manager
Leipziger Volksbank eG e,Order to Cash Specialist,Germany,15-04-2026,Hiring Manager
Leipziger Volksbank eG f,Collections Specialist,Germany,15-04-2026,Hiring Manager
Leipziger Volksbank eG g,Billing Analyst,Germany,15-04-2026,Hiring Manager
Leipziger Volksbank eG h,Credit Control Analyst,Germany,15-04-2026,Hiring Manager
