company_name,role,country,date,hr_name
Pharmazeutisches Institut der Universität Bonn b,Hospital Pharmacist,Germany,30-04-2026,Hiring Manager
Pharmazeutisches Institut der Universität Bonn c,Clinical Pharmacist,Germany,30-04-2026,Hiring Manager
Haupt Pharma Münster GmbH a,Inpatient Pharmacist,Germany,30-04-2026,Hiring Manager
nutrimmun GmbH a,Outpatient Pharmacist,Germany,30-04-2026,Hiring Manager
Confido Pharma GmbH a,Pharmacy Officer,Germany,30-04-2026,Hiring Manager
"Medi-Tech GmbH, Münster a",Medication Safety Pharmacist,Germany,30-04-2026,Hiring Manager
Diapharm GmbH & Co. KG a,Drug Safety Associate,Germany,30-04-2026,Hiring Manager
