company_name,role,country,date,hr_name
Inway Systems GmbH a,SAP FICO Consultant,Germany,27-04-2026,Hiring Manager
Inway Systems GmbH b,SAP S/4HANA FICO Consultant,Germany,27-04-2026,Hiring Manager
WP Nova GmbH a,SAP Finance Consultant,Germany,27-04-2026,Hiring Manager
AIS alfaplan GmbH a,SAP Functional Consultant (FI/CO),Germany,27-04-2026,Hiring Manager
Toowoxx IT GmbH a,SAP Finance Lead,Germany,27-04-2026,Hiring Manager
Toowoxx IT GmbH b,SAP Implementation Consultant,Germany,27-04-2026,Hiring Manager
