company_name,role,country,date,hr_name
DATEX Software GmbH a,Journalist,Germany,01-05-2026,Hiring Manager
Next Iteration Gesellschaft für Software Engineering mbH a,Multimedia Journalist,Germany,01-05-2026,Hiring Manager
Next Iteration Gesellschaft für Software Engineering mbH b,Reporter,Germany,01-05-2026,Hiring Manager
ITstrategen GmbH a,News Reporter,Germany,01-05-2026,Hiring Manager
ITstrategen GmbH b,Digital Content Producer,Germany,01-05-2026,Hiring Manager
PLANTA Projektmanagement-Systeme GmbH a,Video Journalist,Germany,01-05-2026,Hiring Manager
PLANTA Projektmanagement-Systeme GmbH b,Broadcast Journalist,Germany,01-05-2026,Hiring Manager
