company_name,role,country,date,hr_name
cs concept GmbH a,CXM Transformation Lead,Germany,16-04-2026,Hiring Manager
Ramge Software Distribution GmbH & Co. KG a,Customer Experience Manager,Germany,16-04-2026,Hiring Manager
Ramge Software Distribution GmbH & Co. KG b,CRM Program Manager,Germany,16-04-2026,Hiring Manager
NoseDat a,CX Strategy Lead,Germany,16-04-2026,Hiring Manager
Gefasoft Engineering GmbH a,Contact Center Transformation Lead,Germany,16-04-2026,Hiring Manager
MIK Web a,CX Consultant,Germany,16-04-2026,Hiring Manager
GEFASOFT Automation and Software GmbH Regensburg a,Digital Transformation Manager (CXM),Germany,16-04-2026,Hiring Manager
