company_name,role,country,date,hr_name
we.Beyond IT® | IT Systemhaus Ulm a,Data Analyst,Germany,17-04-2026,Hiring Manager
Public Cloud Group GmbH a,Senior Data Analyst,Germany,17-04-2026,Hiring Manager
Bechtle IT-Systemhaus Ulm a,Business Intelligence Analyst,Germany,17-04-2026,Hiring Manager
Systemhaus Ulm GmbH a,MIS Analyst,Germany,17-04-2026,Hiring Manager
ISD Software und Systeme GmbH a,Reporting Analyst,Germany,17-04-2026,Hiring Manager
immersight GmbH a,Power BI Developer,Germany,17-04-2026,Hiring Manager
Axians Infoma GmbH a,Data Reporting Analyst,Germany,17-04-2026,Hiring Manager
