company_name,role,country,date,hr_name
Das 369 Studio - Softwareentwicklung - KI Agenten - Regensburg c,Senior Product Manager,Germany,06-05-2026,Hiring Manager
Bechtle IT-Systemhaus Regensburg a,Lead Product Manager,Germany,06-05-2026,Hiring Manager
ondeso GmbH – Client Management System – Software für OT a,Principal Product Manager,Germany,06-05-2026,Hiring Manager
cs concept GmbH a,Product Director,Germany,06-05-2026,Hiring Manager
Ramge Software Distribution GmbH & Co. KG a,Director of Product Management,Germany,06-05-2026,Hiring Manager
Ramge Software Distribution GmbH & Co. KG b,AI Product Manager,Germany,06-05-2026,Hiring Manager
NoseDat a,Generative AI Product Manager,Germany,06-05-2026,Hiring Manager
