company_name,role,country,date,hr_name
Vector Informatik GmbH as,Embedded Software Engineer,Germany,18-04-2026,Hiring Manager
Vector Informatik GmbH at,Test Automation Engineer,Germany,18-04-2026,Hiring Manager
Vector Informatik GmbH au,Embedded Linux Engineer,Germany,18-04-2026,Hiring Manager
Vector Informatik GmbH av,BSP Engineer,Germany,18-04-2026,Hiring Manager
Vector Informatik GmbH aw,Systems Validation Engineer,Germany,18-04-2026,Hiring Manager
Vector Informatik GmbH ax,QA Automation Engineer Embedded,Germany,18-04-2026,Hiring Manager
Vector Informatik GmbH ay,Linux Systems Engineer,Germany,18-04-2026,Hiring Manager
