company_name,role,country,date,hr_name
generic.de software technologies AG a,Marketing Executive,Germany,13-04-2026,Hiring Manager
generic.de software technologies AG b,Marketing Coordinator,Germany,13-04-2026,Hiring Manager
arconsis a,Digital Marketing Executive,Germany,13-04-2026,Hiring Manager
arconsis b,Brand Executive,Germany,13-04-2026,Hiring Manager
cjt Systemsoftware AG a,PR Executive,Germany,13-04-2026,Hiring Manager
IT-Choice Software GmbH a,Client Services Executive,Germany,13-04-2026,Hiring Manager
Vector Informatik GmbH a,Marketing Assistant,Germany,13-04-2026,Hiring Manager
