company_name,role,country,date,hr_name
Schwenk IT GmbH a,Marketing Executive,Germany,01-05-2026,Hiring Manager
PRODATA Datenbanken und Informationssysteme GmbH a,Marketing Coordinator,Germany,01-05-2026,Hiring Manager
NinjaConcept GmbH a,Digital Marketing Executive,Germany,01-05-2026,Hiring Manager
Industrial Application Software GmbH a,Brand Executive,Germany,01-05-2026,Hiring Manager
ERAB IT-Systems GmbH a,PR Executive,Germany,01-05-2026,Hiring Manager
Bechtle IT-Systemhaus Darmstadt a,Client Services Executive,Germany,01-05-2026,Hiring Manager
