company_name,role,country,date,hr_name
Palark GmbH a,Data Analyst,Germany,24-04-2026,Hiring Manager
ADLON Intelligent Solutions GmbH a,Senior Data Analyst,Germany,24-04-2026,Hiring Manager
ADLON Intelligent Solutions GmbH b,Business Intelligence Analyst,Germany,24-04-2026,Hiring Manager
Polygran GmbH a,MIS Analyst,Germany,24-04-2026,Hiring Manager
GSMB Agency GmbH a,Reporting Analyst,Germany,24-04-2026,Hiring Manager
IT Consulting Kühnl a,Power BI Developer,Germany,24-04-2026,Hiring Manager
Inway Systems GmbH a,Data Reporting Analyst,Germany,24-04-2026,Hiring Manager
