company_name,role,country,date,hr_name
GBS mbH a,Salesforce QA Lead,Germany,22-04-2026,Hiring Manager
AKOS Beratungs- und Reengineerings GmbH Informationssysteme a,Salesforce QA Engineer,Germany,22-04-2026,Hiring Manager
Bechtle direct GmbH a,QA Lead,Germany,22-04-2026,Hiring Manager
Bechtle direct GmbH b,Test Lead,Germany,22-04-2026,Hiring Manager
Bechtle direct GmbH c,Senior QA Engineer,Germany,22-04-2026,Hiring Manager
Bechtle direct GmbH d,Software Test Engineer,Germany,22-04-2026,Hiring Manager
Bechtle direct GmbH e,Salesforce Tester,Germany,22-04-2026,Hiring Manager
