company_name,role,country,date,hr_name
GSMB Agency GmbH a,Frontend Engineer,Germany,22-04-2026,Hiring Manager
IT Consulting Kühnl a,Senior Frontend Developer,Germany,22-04-2026,Hiring Manager
Inway Systems GmbH a,UI Engineer,Germany,22-04-2026,Hiring Manager
Inway Systems GmbH b,Angular Developer,Germany,22-04-2026,Hiring Manager
WP Nova GmbH a,React Developer,Germany,22-04-2026,Hiring Manager
AIS alfaplan GmbH a,Frontend Software Engineer,Germany,22-04-2026,Hiring Manager
Toowoxx IT GmbH a,Web Application Developer,Germany,22-04-2026,Hiring Manager
