company_name,role,country,date,hr_name
Vector Informatik GmbH bb,Administrative Officer,Germany,11-04-2026,Hiring Manager
Vector Informatik GmbH bc,Office Administrator,Germany,11-04-2026,Hiring Manager
DSC Software AG a,Operations Executive,Germany,11-04-2026,Hiring Manager
emmtrix Technologies GmbH a,Administrative Executive,Germany,11-04-2026,Hiring Manager
bluehands GmbH & Co.mmunication KG a,Office Coordinator,Germany,11-04-2026,Hiring Manager
MCC Software Engineering a,Front Desk Executive,Germany,11-04-2026,Hiring Manager
