company_name,role,country,date,hr_name
Systemhaus Ulm GmbH a,HR Manager,Germany,22-04-2026,Hiring Manager
ISD Software und Systeme GmbH a,Senior HR Manager,Germany,22-04-2026,Hiring Manager
immersight GmbH a,HR Business Partner,Germany,22-04-2026,Hiring Manager
Axians Infoma GmbH a,People Operations Manager,Germany,22-04-2026,Hiring Manager
digital ZEIT GmbH a,HR Operations Manager,Germany,22-04-2026,Hiring Manager
Gerling Consulting GmbH a,Talent Acquisition Manager,Germany,22-04-2026,Hiring Manager
Lemonize GmbH a,HR Generalist,Germany,22-04-2026,Hiring Manager
